<?xml version="1.0" encoding="UTF-8"?>
<!DOCTYPE rapport SYSTEM "./mandat.dtd">
<rapport>
    <mandat num="7124536" date="2007-1-1" montant="1000" etat="Recu">
        <expediteur cin="A12345" nom="Slimani" prenom="Youssef" ville="Casa"/>
        <destinataire cin="P98654" nom="Hassouni" prenom="Laila" ville="Fes"/>
    </mandat>
    <mandat num="7124537" date="2007-1-1" montant="3200" etat="Non_Recu">
        <expediteur cin="M12345" nom="Alaoui" prenom="Mohamed" ville="Marakech"/>
        <destinataire cin="M92654" nom="Alaoui" prenom="Imane" ville="Fes"/>
    </mandat>
    <mandat num="7124538" date="2007-1-1" montant="500" etat="Recu">
        <expediteur cin="H123222" nom="Qasmi" prenom="Slim" ville="Oujda"/>
        <destinataire cin="B91154" nom="Qasmi" prenom="Hassan" ville="Rabat"/>
    </mandat>
</rapport>